url,title,description,headerImage,releaseDate,comingSoon,earlyAccess,price,sale,salePercentage,saleUntil,recentReviews,allReviews,isDLC,baseDLCGame,developers/0,developers/1,developers/2,developers/3,developers/4,developers/5,developers/6,developers/7,developers/8,developers/9,developers/10,developers/11,developers/12,developers/13,developers/14,developers/15,developers/16,developers/17,developers/18,developers/19,features/0,features/1,features/2,features/3,features/4,features/5,features/6,features/7,features/8,features/9,features/10,features/11,features/12,features/13,features/14,features/15,features/16,features/17,features/18,features/19,genres/0,genres/1,genres/2,genres/3,genres/4,genres/5,genres/6,genres/7,genres/8,genres/9,genres/10,genres/11,genres/12,genres/13,genres/14,genres/15,genres/16,genres/17,genres/18,genres/19,popularTags/0,popularTags/1,popularTags/2,popularTags/3,popularTags/4,popularTags/5,popularTags/6,popularTags/7,popularTags/8,popularTags/9,popularTags/10,popularTags/11,popularTags/12,popularTags/13,popularTags/14,popularTags/15,popularTags/16,popularTags/17,popularTags/18,popularTags/19,publishers/0,publishers/1,publishers/2,publishers/3,publishers/4,publishers/5,publishers/6,publishers/7,publishers/8,publishers/9,publishers/10,publishers/11,publishers/12,publishers/13,publishers/14,publishers/15,publishers/16,publishers/17,publishers/18,publishers/19,supportedPlatforms/0,supportedPlatforms/1,supportedPlatforms/2,supportedPlatforms/3,supportedPlatforms/4,supportedPlatforms/5,supportedPlatforms/6,supportedPlatforms/7,supportedPlatforms/8,supportedPlatforms/9,supportedPlatforms/10,supportedPlatforms/11,supportedPlatforms/12,supportedPlatforms/13,supportedPlatforms/14,supportedPlatforms/15,supportedPlatforms/16,supportedPlatforms/17,supportedPlatforms/18,supportedPlatforms/19,languages/English/interface,languages/English/sound,languages/English/subtitles,languages/French/interface,languages/French/sound,languages/French/subtitles,languages/German/interface,languages/German/sound,languages/German/subtitles,languages/Spanish - Spain/interface,languages/Spanish - Spain/sound,languages/Spanish - Spain/subtitles
https://store.steampowered.com/app/1153410?snr=1_4_4__40_1,JDM: Japanese Drift Master,"Discover Japan’s legendary car culture in JDM! Take on challenging mountain roads, visit Japanese legendary drifting spots in licensed JDM cars and immerse in the story about second chances told through manga pages. Explore an open world where every turn invites you to master the art of drift.",https://shared.akamai.steamstatic.com/store_item_assets/steam/apps/1153410/105ff87631aa74393640d23cc37269a0d8e60a82/header.jpg?t=1762463972,"May 21, 2025",False,False,$22.74,True,-35%,WEEKEND DEAL! Offer ends November 20,Mixed,Very Positive,,,Gaming Factory,,,,,,,,,,,,,,,,,,,,Single-player,Steam Achievements,Steam Trading Cards,Steam Cloud,Steam Leaderboards,Family Sharing,,,,,,,,,,,,,,,Casual,Racing,Simulation,Sports,,,,,,,,,,,,,,,,,Arcade,Open World,Racing,Driving,Controller,Physics,Story Rich,Sports,Exploration,Casual,Realistic,Simulation,Singleplayer,Atmospheric,Third Person,Colorful,Multiplayer,3D,Automobile Sim,Offroad,Gaming Factory,4Divinity,,,,,,,,,,,,,,,,,,,windows,,,,,,,,,,,,,,,,,,,,True,True,True,True,False,True,True,False,True,True,False,True
https://store.steampowered.com/app/1237320?snr=1_4_4__40_1,Sonic Frontiers,Experience Sonic like never before!,https://shared.fastly.steamstatic.com/store_item_assets/steam/apps/1237320/header.jpg?t=1741795892,"Nov 7, 2022",False,False,$11.99,True,-80%,WEEKEND DEAL! Offer ends November 13,Very Positive,Mixed,,,Sonic Team,,,,,,,,,,,,,,,,,,,,Single-player,Steam Achievements,Steam Trading Cards,Steam Cloud,Family Sharing,,,,,,,,,,,,,,,,Action,Adventure,,,,,,,,,,,,,,,,,,,Great Soundtrack,Open World,Adventure,3D Platformer,Action,Exploration,Singleplayer,Action-Adventure,Fast-Paced,3D,Third Person,Platformer,Story Rich,Combat,Lore-Rich,Colorful,Fantasy,Action RPG,Comedy,Mature,SEGA,,,,,,,,,,,,,,,,,,,,windows,,,,,,,,,,,,,,,,,,,,True,True,True,True,True,True,True,True,True,True,True,True
https://store.steampowered.com/app/469600/Legion_TD_2__Multiplayer_Tower_Defense/?snr=1_4_4__43_1,Legion TD 2 - Multiplayer Tower Defense,"An infinitely replayable multiplayer and single-player tower defense. Defend against waves of enemies and destroy the enemy's king before they destroy yours. Legion TD 2 is a one-of-a-kind game of tactics, teamwork, and prediction. Party as 1-8 players.",https://shared.akamai.steamstatic.com/store_item_assets/steam/apps/469600/header.jpg?t=1755808916,"Oct 1, 2021",False,False,$7.49,True,-70%,DAILY DEAL! Offer ends November 17,Mostly Positive,Very Positive,,,AutoAttack Games,,,,,,,,,,,,,,,,,,,,Single-player,Online PvP,Online Co-op,Steam Achievements,Steam Trading Cards,Stats,,,,,,,,,,,,,,,Casual,Indie,Strategy,,,,,,,,,,,,,,,,,,Tower Defense,Multiplayer,Auto Battler,Strategy,PvP,Replay Value,Competitive,PvE,Online Co-Op,Co-op,Base Building,Resource Management,Fantasy,Sci-fi,Magic,3D,Mechs,Survival,2D,Medieval,AutoAttack Games,,,,,,,,,,,,,,,,,,,,windows,mac,,,,,,,,,,,,,,,,,,,True,True,False,True,False,False,True,False,False,True,False,False
https://store.steampowered.com/app/1771300/Kingdom_Come_Deliverance_II/?snr=1_4_4__40_2,Kingdom Come: Deliverance II,"A thrilling story-driven action RPG, with a rich open world, set in 15th century Medieval Europe. Experience the ultimate medieval adventure - through the eyes of young Henry - as you embark on a journey of epic proportions.",https://shared.fastly.steamstatic.com/store_item_assets/steam/apps/1771300/0101ee56ada8a294071a8dbb36db44070cd6b50b/header_alt_assets_4.jpg?t=1761570094,"Feb 4, 2025",False,False,$35.99,True,-40%,WEEKEND DEAL! Offer ends November 13,Very Positive,Very Positive,,,Warhorse Studios,,,,,,,,,,,,,,,,,,,,Single-player,Steam Achievements,Steam Trading Cards,Steam Cloud,Family Sharing,,,,,,,,,,,,,,,,Action,Adventure,RPG,,,,,,,,,,,,,,,,,,RPG,Medieval,Open World,Singleplayer,Realistic,First-Person,Story Rich,Adventure,Action,Combat,Historical,Swordplay,Political,Immersive,Choices Matter,Atmospheric,Alternate History,Action-Adventure,LGBTQ+,3D,Deep Silver,,,,,,,,,,,,,,,,,,,,windows,,,,,,,,,,,,,,,,,,,,True,True,True,True,True,True,True,True,True,True,True,True
https://store.steampowered.com/app/949230?snr=1_4_4__40_2,Cities: Skylines II,"Raise a city from the ground up and transform it into a thriving metropolis with the most realistic city builder ever. Push your creativity and problem-solving to build on a scale you've never experienced. With deep simulation and a living economy, this is world-building without limits.",https://shared.akamai.steamstatic.com/store_item_assets/steam/apps/949230/955ad4e5988c846f8f3817f811e3535ad501694a/header_alt_assets_6.jpg?t=1762452015,"Oct 24, 2023",False,False,$39.99,True,-20%,WEEKEND DEAL! Offer ends November 12,Mixed,Mixed,,,Colossal Order Ltd.,,,,,,,,,,,,,,,,,,,,Single-player,Steam Achievements,Steam Cloud,Family Sharing,,,,,,,,,,,,,,,,,Simulation,,,,,,,,,,,,,,,,,,,,City Builder,Simulation,Building,Sandbox,Singleplayer,Management,Economy,Strategy,Realistic,Moddable,Relaxing,Resource Management,Transportation,Casual,Atmospheric,Multiplayer,Early Access,Open World,Mod,Great Soundtrack,Paradox Interactive,,,,,,,,,,,,,,,,,,,,windows,,,,,,,,,,,,,,,,,,,,True,False,False,True,False,False,True,False,False,True,False,False
https://store.steampowered.com/app/860950/Mark_of_the_Ninja_Remastered/?snr=1_4_4__43_1,Mark of the Ninja: Remastered,"In Mark of the Ninja, you'll know what it is to truly be a ninja. You must be silent, agile and clever to outwit your opponents in a world of gorgeous scenery and flowing animation.",https://shared.akamai.steamstatic.com/store_item_assets/steam/apps/860950/header.jpg?t=1701911769,"Oct 9, 2018",False,False,$5.99,True,-70%,DAILY DEAL! Offer ends November 13,Very Positive,Very Positive,,,Klei Entertainment,,,,,,,,,,,,,,,,,,,,Single-player,Steam Achievements,Steam Cloud,Commentary available,Family Sharing,,,,,,,,,,,,,,,,Action,Indie,,,,,,,,,,,,,,,,,,,Stealth,Ninja,2D,Indie,Action,Platformer,Violent,Side Scroller,Singleplayer,Gore,Assassin,Atmospheric,Remake,Adventure,Puzzle,Story Rich,2D Platformer,Hack and Slash,Anime,Metroidvania,Klei Entertainment ,,,,,,,,,,,,,,,,,,,,windows,linux,mac,,,,,,,,,,,,,,,,,,True,True,False,True,False,False,True,False,False,True,False,False
https://store.steampowered.com/app/1527950?snr=1_4_4__40_2,Wartales,"Wartales is an open world RPG in which you lead a group of mercenaries in their search for wealth across a massive medieval universe. Explore the world, recruit companions, collect bounties and unravel the secrets of the tombs of the ancients!",https://shared.fastly.steamstatic.com/store_item_assets/steam/apps/1527950/header.jpg?t=1762261437,"Apr 12, 2023",False,False,$12.94,True,-63%,WEEKEND DEAL! Offer ends November 13,Mostly Positive,Very Positive,,,Shiro Games,,,,,,,,,,,,,,,,,,,,Single-player,Online Co-op,Steam Achievements,Steam Cloud,Family Sharing,,,,,,,,,,,,,,,,Adventure,Indie,RPG,Strategy,,,,,,,,,,,,,,,,,RPG,Open World,Turn-Based Strategy,Party-Based RPG,Medieval,Co-op,Turn-Based Combat,Adventure,Tactical RPG,Strategy,Multiplayer,Singleplayer,Exploration,Sandbox,Survival,Turn-Based,Online Co-Op,Story Rich,Indie,Violent,Shiro Games,,,,,,,,,,,,,,,,,,,,windows,,,,,,,,,,,,,,,,,,,,True,True,True,True,False,True,True,False,True,True,False,True
https://store.steampowered.com/app/3973840/Spirit_Island__Nature_Incarnate/?snr=1_4_4__145,Spirit Island - Nature Incarnate,,https://shared.fastly.steamstatic.com/store_item_assets/steam/apps/3973840/839a2e7257423463b2b2b65024edda1a56a3ab62/header.jpg?t=1762451411,"Nov 6, 2025",False,False,$20.00,True,-13%,INTRODUCTORY OFFER! Offer ends November 20,4 user reviews,4 user reviews,True,https://store.steampowered.com/app/1236720/,Handelabra Games Inc.,,,,,,,,,,,,,,,,,,,,Single-player,Online Co-op,Shared/Split Screen Co-op,Cross-Platform Multiplayer,Downloadable Content,Steam Achievements,Steam Trading Cards,Steam Cloud,Stats,Remote Play Together,Family Sharing,Steam Timeline,,,,,,,,,Indie,Strategy,,,,,,,,,,,,,,,,,,,Indie,Board Game,Nature,Strategy,Turn-Based Tactics,Destruction,Grand Strategy,Tabletop,Card Game,Local Co-Op,2D,Deckbuilding,Fantasy,Co-op,Local Multiplayer,Singleplayer,Early Access,Multiplayer,Magic,Psychological Horror,Handelabra Games Inc.,,,,,,,,,,,,,,,,,,,,windows,linux,mac,,,,,,,,,,,,,,,,,,True,False,False,,,,,,,,,
https://store.steampowered.com/app/2059090/Sanatorium__A_Mental_Asylum_Simulator/?snr=1_4_4__145,Sanatorium - A Mental Asylum Simulator,"The year is 1923—step inside Castle Woods Sanatorium, where care and cruelty blur together. Disguised as a doctor, you’ll diagnose and treat patients using a deck of symptoms, tests, and outdated therapies. But tread carefully: one wrong move could expose you as an impostor.",https://shared.fastly.steamstatic.com/store_item_assets/steam/apps/2059090/d9a4b7fe10b1ed18d2b4deabc4fffdd3c657fcd0/header.jpg?t=1762447764,"Nov 6, 2025",False,False,$9.74,True,-25%,INTRODUCTORY OFFER! Offer ends November 18,Positive,Positive,,,Zeitglas,,,,,,,,,,,,,,,,,,,,Single-player,Steam Achievements,Steam Cloud,Family Sharing,,,,,,,,,,,,,,,,,Adventure,Indie,Simulation,,,,,,,,,,,,,,,,,,Medical Sim,Puzzle,Detective,Political,Card Game,Point & Click,2D,Noir,Historical,Alternate History,Choices Matter,Deckbuilding,Multiple Endings,Story Rich,Simulation,Atmospheric,Mystery,Psychological,Adventure,Dark,Shoreline Games,,,,,,,,,,,,,,,,,,,,windows,mac,,,,,,,,,,,,,,,,,,,True,False,True,True,False,True,True,False,True,True,False,True
https://store.steampowered.com/app/3657210/Amanda_the_Adventurer_3/?snr=1_4_4__145,Amanda the Adventurer 3,"In the thrilling conclusion of the Amanda the Adventurer trilogy, follow Riley as they uncover the ultimate secrets behind Amanda, Hameln, and mysteries that have plagued Kensdale for decades.",https://shared.fastly.steamstatic.com/store_item_assets/steam/apps/3657210/4906f79a382770ada1011b3acce752f050907561/header.jpg?t=1762451739,"Nov 6, 2025",False,False,$8.49,True,-15%,INTRODUCTORY OFFER! Offer ends November 20,9 user reviews,9 user reviews,,,MANGLEDmaw Games,,,,,,,,,,,,,,,,,,,,Single-player,Steam Achievements,Family Sharing,,,,,,,,,,,,,,,,,,Adventure,Indie,,,,,,,,,,,,,,,,,,,Adventure,Puzzle,Interactive Fiction,Choose Your Own Adventure,Exploration,3D,Horror,First-Person,Psychological Horror,Thriller,1990's,Mystery,Supernatural,Multiple Endings,Story Rich,Singleplayer,Escape Room,Indie,,,DreadXP,,,,,,,,,,,,,,,,,,,,windows,,,,,,,,,,,,,,,,,,,,True,True,True,True,False,True,True,False,True,,,
https://store.steampowered.com/app/1476970/IdleOn/?snr=1_4_4__145,IdleOn,"The management RPG where your heroes keep fighting even when you're gone! Spend their loot on upgrades, unlock classes from Elemental Wizard to Cannon Pirate, and level up 19 unique skills like Farming, Sailing, and even Construction!",https://shared.fastly.steamstatic.com/store_item_assets/steam/apps/1476970/6112e7f5850062f87727ea405061027ba86cc6bb/header_alt_assets_8.jpg?t=1762451810,"Nov 6, 2025",False,False,Free To Play,False,,,Very Positive,Mostly Positive,,,Lavaflame2,,,,,,,,,,,,,,,,,,,,Single-player,MMO,Online Co-op,Cross-Platform Multiplayer,Steam Achievements,In-App Purchases,,,,,,,,,,,,,,,Casual,Indie,Massively Multiplayer,RPG,Simulation,Free To Play,,,,,,,,,,,,,,,Idler,Free to Play,Pixel Graphics,MMORPG,Multiplayer,Management,RPG,Clicker,Crafting,Resource Management,Sandbox,Massively Multiplayer,Indie,Casual,Simulation,Character Customization,PvE,Old School,Early Access,Cute,Lavaflame2,,,,,,,,,,,,,,,,,,,,windows,,,,,,,,,,,,,,,,,,,,True,True,True,True,True,True,True,True,True,,,
https://store.steampowered.com/app/3187010/Dinocop/?snr=1_4_4__145,Dinocop,"When dinosaurs were brought back to life, none wanted to be a cop, so humans made you: Dinocop. Investigate the guests of the Cretaceous hotel to crack a meaty case that will confront you with your most profound existential dilemma. Who brought human meat to the dinosaur rights convention ?",https://shared.fastly.steamstatic.com/store_item_assets/steam/apps/3187010/7d9461adc223e23077339bc2140514cbf9900b30/header.jpg?t=1762441249,"Nov 6, 2025",False,False,$13.49,True,-10%,INTRODUCTORY OFFER! Offer ends November 13,Positive,Positive,,,Pieces Games,,,,,,,,,,,,,,,,,,,,Single-player,Steam Achievements,Steam Cloud,Family Sharing,,,,,,,,,,,,,,,,,Adventure,Casual,Indie,,,,,,,,,,,,,,,,,,Funny,Dinosaurs,Exploration,Detective,Mystery,Story Rich,Comedy,Dark Comedy,Satire,Casual,Adventure,Investigation,Singleplayer,Dark Humor,Nonlinear,First-Person,Time Manipulation,Stylized,Point & Click,Interactive Fiction,Pieces Games,,,,,,,,,,,,,,,,,,,,windows,,,,,,,,,,,,,,,,,,,,True,False,True,True,False,True,,,,,,
https://store.steampowered.com/app/2897610/Egging_On/?snr=1_4_4__145,Egging On,"This game is hard-boiled. Face the challenge of being a real, fragile egg. Escape the hen-house and jump, roll and climb your way through a farm shop, factory and other perilous environments. With some determination, you might just reach your freedom.",https://shared.fastly.steamstatic.com/store_item_assets/steam/apps/2897610/header.jpg?t=1762441233,"Nov 6, 2025",False,False,$12.74,True,-15%,INTRODUCTORY OFFER! Offer ends November 17,Positive,Positive,,,Egobounds,,,,,,,,,,,,,,,,,,,,Single-player,Steam Achievements,Steam Trading Cards,Steam Cloud,Family Sharing,,,,,,,,,,,,,,,,Action,Adventure,Indie,Simulation,,,,,,,,,,,,,,,,,Difficult,Precision Platformer,Physics,Psychological Horror,Philosophical,Action,Platformer,Singleplayer,Adventure,Simulation,Horror,Casual,Dark Humor,Funny,Third Person,Replay Value,Controller,3D Platformer,Atmospheric,Souls-like,Alibi Games,IndieArk,,,,,,,,,,,,,,,,,,,windows,,,,,,,,,,,,,,,,,,,,True,True,True,True,False,True,True,False,True,True,False,True
https://store.steampowered.com/app/1793330/Brew/?snr=1_4_4__145,Brew,"Face the challenges of The Tower as you enroll into the Alchemy Academy in this action-packed, third-person, roguelite. Brew potions to boost yourself in the heat of battle and use multiple weapons to defeat dangerous foes and pass your exams!",https://shared.fastly.steamstatic.com/store_item_assets/steam/apps/1793330/header.jpg?t=1762430240,"Nov 6, 2025",False,False,$15.99,True,-20%,INTRODUCTORY OFFER! Offer ends November 20,Positive,Positive,,,Snow Leaf Studios,,,,,,,,,,,,,,,,,,,,Single-player,Steam Achievements,Steam Cloud,Family Sharing,,,,,,,,,,,,,,,,,Action,Indie,RPG,,,,,,,,,,,,,,,,,,Action Roguelike,Action,Roguelike,RPG,Indie,Roguelite,Crafting,Third-Person Shooter,3D,Colorful,Cute,Family Friendly,Fantasy,Linear,Combat,Controller,Singleplayer,,,,Snow Leaf Studios,,,,,,,,,,,,,,,,,,,,windows,,,,,,,,,,,,,,,,,,,,True,False,False,True,False,False,True,False,False,True,False,False
https://store.steampowered.com/app/3837380/Majogami/?snr=1_4_4__145,Majogami,"Majogami stars Shiroha, a young woman who has lost her memory, who travels alongside Shiori, her father who has been turned to paper. With her katana, ""Kamikiri"", in hand, she travels through a bizarre world and cuts through the horrors she finds there in this 2D character action platformer.",https://shared.fastly.steamstatic.com/store_item_assets/steam/apps/3837380/b492e0fd74580d9778d4db5860f0bdc53c5ffe68/header.jpg?t=1762434785,"Nov 6, 2025",False,False,$22.49,True,-10%,SPECIAL PROMOTION! Offer ends November 17,Positive,Positive,,,"INTI CREATES CO., LTD.",,,,,,,,,,,,,,,,,,,,Single-player,Steam Achievements,Steam Cloud,Steam Leaderboards,Family Sharing,,,,,,,,,,,,,,,,Action,Adventure,,,,,,,,,,,,,,,,,,,Action,Adventure,Action-Adventure,Hack and Slash,Side Scroller,2D,Anime,Hand-drawn,Female Protagonist,Dark Fantasy,Violent,Singleplayer,,,,,,,,,"INTI CREATES CO., LTD.",,,,,,,,,,,,,,,,,,,,windows,,,,,,,,,,,,,,,,,,,,True,False,True,True,False,True,,,,True,False,True
https://store.steampowered.com/app/2701800/No_Players_Online/?snr=1_4_4__145,No Players Online,you find an abandoned fps game on an old computer. you decide to play it.,https://shared.fastly.steamstatic.com/store_item_assets/steam/apps/2701800/header.jpg?t=1762441947,"Nov 6, 2025",False,False,$13.49,True,-10%,INTRODUCTORY OFFER! Offer ends November 20,Positive,Positive,,,Beeswax Games,,,,,,,,,,,,,,,,,,,,Single-player,Steam Achievements,Steam Cloud,Family Sharing,,,,,,,,,,,,,,,,,Action,Adventure,Indie,Simulation,,,,,,,,,,,,,,,,,Horror,Story Rich,Simulation,Adventure,Atmospheric,Interactive Fiction,FPS,Abstract,Retro,Puzzle,Singleplayer,Psychological Horror,Walking Simulator,Immersive Sim,Supernatural,3D,First-Person,Game Development,1980s,Hacking,Black Lantern Collective,,,,,,,,,,,,,,,,,,,,windows,,,,,,,,,,,,,,,,,,,,True,False,True,True,False,True,True,False,True,True,False,True
https://store.steampowered.com/app/2165140/Kentum/?snr=1_4_4__145,Kentum,"Stranded in the year 10,000, Kent—an average Joe turned clone—must survive, explore, and rebuild civilization with the help of a quirky robot companion. Craft, farm, and automate in this 2D craftervania adventure as you uncover Earth’s secrets and kickstart humanity, one machine at a time.",https://shared.fastly.steamstatic.com/store_item_assets/steam/apps/2165140/fa921b84e776e0379277a49e9e9e44fe805f417b/header.jpg?t=1762459685,"Nov 6, 2025",False,False,$17.99,False,,,Positive,Positive,,,Tlön Industries,,,,,,,,,,,,,,,,,,,,Single-player,Steam Achievements,Steam Cloud,Remote Play Together,Family Sharing,,,,,,,,,,,,,,,,Action,Adventure,Simulation,,,,,,,,,,,,,,,,,,Survival,Crafting,Base Building,Metroidvania,Automation,Open World Survival Craft,Building,Post-apocalyptic,Funny,Action,Exploration,Cooking,Stylized,Adventure,Atmospheric,Comedy,Futuristic,Platformer,Simulation,Singleplayer,indienova,V Publishing,,,,,,,,,,,,,,,,,,,windows,,,,,,,,,,,,,,,,,,,,True,True,True,True,False,True,True,True,True,True,True,True
https://store.steampowered.com/app/2286780/Aeruta/?snr=1_4_4__145,Aeruta,"A bread revolution across the world now begins! Aeruta is a side-scrolling action game with a shop management twist, fight monsters for materials and use them to make breads, then finally make the deserted town popular again!",https://shared.fastly.steamstatic.com/store_item_assets/steam/apps/2286780/1d52425b6de6f041333b75db6a8d636a57b45841/header.jpg?t=1762397471,"Nov 5, 2025",False,False,$11.99,True,-20%,DAILY DEAL! Offer ends November 12,Very Positive,Very Positive,,,FromDawn Games,,,,,,,,,,,,,,,,,,,,Single-player,Steam Achievements,Steam Cloud,Family Sharing,,,,,,,,,,,,,,,,,Action,Adventure,Indie,RPG,,,,,,,,,,,,,,,,,Indie,Pixel Graphics,Character Action Game,Action-Adventure,RPG,Management,2D Platformer,Relaxing,Cooking,Casual,Anime,Female Protagonist,Simulation,Adventure,Shop Keeper,Singleplayer,2D,Funny,Cute,Action,"GRAVITY GAME ARISE Co., Ltd.",,,,,,,,,,,,,,,,,,,,windows,,,,,,,,,,,,,,,,,,,,True,False,True,,,,,,,,,
https://store.steampowered.com/app/2453840/Dark_Quest_4/?snr=1_4_4__145,Dark Quest 4,A turn based dungeon crawler where you create a party of heroes to go on epic quests.,https://shared.akamai.steamstatic.com/store_item_assets/steam/apps/2453840/header.jpg?t=1762365716,"Nov 5, 2025",False,False,$17.99,True,-10%,INTRODUCTORY OFFER! Offer ends November 16,Positive,Positive,,,Brain Seal Ltd,,,,,,,,,,,,,,,,,,,,Single-player,Online Co-op,Steam Achievements,Steam Workshop,Steam Cloud,Includes level editor,Family Sharing,,,,,,,,,,,,,,RPG,Strategy,,,,,,,,,,,,,,,,,,,Dungeon Crawler,Board Game,Turn-Based Tactics,Party-Based RPG,RPG,Tabletop,Strategy,Turn-Based Strategy,2D,Isometric,Dragons,Turn-Based Combat,Pixel Graphics,Dark Fantasy,Fantasy,Class-Based,Exploration,Level Editor,Moddable,1980s,Brain Seal Ltd,,,,,,,,,,,,,,,,,,,,windows,,,,,,,,,,,,,,,,,,,,True,True,True,True,False,False,True,False,False,True,False,False
https://store.steampowered.com/app/3548520/DOG_WITCH/?snr=1_4_4__145,DOG WITCH,"Dog Witch is a roguelike deckbuilder where your spells are fueled by enchanted dice. Combine over 150 unique items to forge ever-evolving strategies, perfect synergy combos, summon minions, and tackle an endless range of foes so bizarre, they’ll leave your tail wagging in disbelief!",https://shared.fastly.steamstatic.com/store_item_assets/steam/apps/3548520/e9fbffd6c0bfacca3cc0750e4ac5caa8092ac552/header.jpg?t=1762438499,"Nov 5, 2025",False,False,$8.99,True,-10%,INTRODUCTORY OFFER! Offer ends November 17,Positive,Positive,,,Heckmouse,,,,,,,,,,,,,,,,,,,,Single-player,Steam Achievements,Steam Cloud,Family Sharing,,,,,,,,,,,,,,,,,Indie,Strategy,,,,,,,,,,,,,,,,,,,Roguelike Deckbuilder,Dice,Card Game,Roguelike,Colorful,Strategy,Singleplayer,Deckbuilding,Roguelite,Replay Value,Procedural Generation,Comedy,Dungeon Crawler,Dog,Choices Matter,Turn-Based Tactics,Psychedelic,Character Customization,3D,Cartoony,Mystic Forge,,,,,,,,,,,,,,,,,,,,windows,mac,,,,,,,,,,,,,,,,,,,True,True,True,True,False,True,True,False,True,True,False,True
https://store.steampowered.com/app/3480990/There_Are_No_Orcs/?snr=1_4_4__145,There Are No Orcs,"An RTS-Roguelike hybrid with auto-battling troops. Master building placement, swarm your enemies, and smash their defenses with unit-commander combos!",https://shared.fastly.steamstatic.com/store_item_assets/steam/apps/3480990/header.jpg?t=1762409022,"Nov 5, 2025",False,False,$7.19,True,-20%,INTRODUCTORY OFFER! Offer ends November 19,Positive,Positive,,,BaseTrade Studio,,,,,,,,,,,,,,,,,,,,Single-player,Steam Achievements,Steam Cloud,Family Sharing,,,,,,,,,,,,,,,,,Indie,Strategy,,,,,,,,,,,,,,,,,,,RTS,Tower Defense,City Builder,Auto Battler,Card Game,Wargame,Strategy,Base Building,Roguelite,Medieval,Fantasy,Military,Pixel Graphics,War,Funny,Magic,Deckbuilding,2D,Singleplayer,Indie,Gamirror Games,,,,,,,,,,,,,,,,,,,,windows,,,,,,,,,,,,,,,,,,,,True,False,True,,,,,,,,,
https://store.steampowered.com/app/4082620/The_Bazaar__Celebrity_Chef_Warrior_Mom_Expansion/?snr=1_4_4__145,The Bazaar - Celebrity Chef Warrior Mom Expansion,,https://shared.fastly.steamstatic.com/store_item_assets/steam/apps/4082620/41403923ecd9b826c6e134ea9ab2f7058551222e/header.jpg?t=1762396936,"Nov 5, 2025",False,False,$19.99,False,,,Positive,Positive,True,https://store.steampowered.com/app/1617400/,Tempo,,,,,,,,,,,,,,,,,,,,Single-player,Downloadable Content,In-App Purchases,,,,,,,,,,,,,,,,,,Strategy,,,,,,,,,,,,,,,,,,,,Strategy,Auto Battler,Deckbuilding,Card Battler,Card Game,PvP,Asynchronous Multiplayer,PvE,Multiplayer,Fantasy,Sci-fi,Capitalism,Economy,Adventure,Family Friendly,Tactical,Futuristic,Combat,Choose Your Own Adventure,Colorful,Tempo,,,,,,,,,,,,,,,,,,,,windows,mac,,,,,,,,,,,,,,,,,,,True,True,False,,,,,,,,,
https://store.steampowered.com/app/2560240/Biped_2/?snr=1_4_4__145,Biped 2,Biped 2 is a coop action adventure game with a strong focus on moment-to-moment collaboration alone or between 2 or 4 players.,https://shared.fastly.steamstatic.com/store_item_assets/steam/apps/2560240/header.jpg?t=1762415703,"Nov 5, 2025",False,False,$17.99,True,-10%,INTRODUCTORY OFFER! Offer ends November 12,Positive,Positive,,,META Publishing,NEXT Studios,PlayJoy Studios,,,,,,,,,,,,,,,,,,Single-player,Online PvP,Shared/Split Screen PvP,Online Co-op,Shared/Split Screen Co-op,Cross-Platform Multiplayer,Steam Achievements,Steam Trading Cards,Steam Workshop,Steam Cloud,Includes level editor,Remote Play Together,Family Sharing,,,,,,,,Action,Adventure,Casual,Indie,Racing,Simulation,Strategy,,,,,,,,,,,,,,Co-op,Funny,Puzzle,Adventure,Online Co-Op,Action,Split Screen,Puzzle Platformer,Party Game,Action-Adventure,Family Friendly,Sandbox,Casual,Physics,3D Platformer,Local Co-Op,Multiplayer,Difficult,Indie,Robots,META Publishing,,,,,,,,,,,,,,,,,,,,windows,,,,,,,,,,,,,,,,,,,,True,False,True,True,False,True,True,False,True,True,False,True
